date,category,subcategory,content
2024-06-01,Human Resource,Performance Management,"On June 1st, the HR department conducted performance appraisals for all employees, providing feedback on their performance over the past evaluation period. The appraisals included discussions on strengths, areas for improvement, and goal setting for the future."
2024-06-02,Human Resource,Performance Management,"June 2nd marked the start of a performance improvement plan for employees who were identified as needing additional support to meet performance expectations. The plan included specific goals, timelines, and support mechanisms."
2024-06-03,Human Resource,Performance Management,An employee recognition program was launched on June 3rd to acknowledge and reward exceptional performance and contributions. The program aimed to motivate employees and reinforce desired behaviors.
2024-06-04,Human Resource,Performance Management,A training session on performance feedback and coaching was conducted on June 4th to equip managers with the skills and techniques to provide constructive feedback and support employee development.
2024-06-05,Human Resource,Performance Management,June 5th saw the introduction of a performance dashboard providing real-time visibility into key performance indicators and metrics for individual employees and teams. The dashboard facilitated performance tracking and goal monitoring.
2024-06-06,Human Resource,Performance Management,A performance calibration session was held on June 6th to ensure consistency and fairness in the evaluation process across departments and teams. The session involved reviewing and aligning performance ratings.
2024-06-07,Human Resource,Performance Management,"The HR department introduced a performance development plan on June 7th, outlining strategies and actions to support employee growth and career advancement. The plan included training, mentoring, and stretch assignments."
2024-06-08,Human Resource,Performance Management,"June 8th marked the start of a performance coaching program where managers provided ongoing support, guidance, and feedback to employees to enhance their performance and development."
2024-06-09,Human Resource,Performance Management,"An employee engagement survey was conducted on June 9th to gather feedback on job satisfaction, work environment, and organizational culture. The survey results informed strategies to improve employee engagement and retention."
2024-06-10,Human Resource,Performance Management,"A performance recognition ceremony was held on June 10th to celebrate and reward top performers. The ceremony showcased achievements and contributions, inspiring others to excel."
2024-06-11,Human Resource,Performance Management,"The HR department introduced a peer recognition program on June 11th, allowing employees to nominate and recognize their colleagues for outstanding performance or contributions. The program promoted a culture of appreciation and collaboration."
2024-06-12,Human Resource,Performance Management,June 12th saw the launch of a performance improvement initiative focusing on providing targeted training and support to employees identified as needing development. The initiative aimed to enhance overall team performance.
2024-06-13,Human Resource,Performance Management,A performance review workshop was conducted on June 13th to train managers on conducting effective performance evaluations and setting meaningful goals with their employees. The workshop provided tools and resources for conducting productive discussions.
2024-06-14,Human Resource,Performance Management,"An employee feedback forum was held on June 14th to provide employees with an opportunity to share their thoughts, concerns, and suggestions related to performance management processes. The feedback informed continuous improvement efforts."
2024-06-15,Human Resource,Performance Management,June 15th marked the start of a performance planning cycle for the upcoming evaluation period. Managers and employees collaborated to set performance goals and expectations aligned with organizational objectives.
2024-06-16,Human Resource,Performance Management,A performance review software was implemented on June 16th to streamline the performance evaluation process and provide managers and employees with easy access to performance data and feedback.
2024-06-17,Human Resource,Performance Management,"The HR department introduced a mentoring program on June 17th, pairing experienced employees with less experienced ones to provide guidance, support, and career development opportunities. The program aimed to foster knowledge sharing and skill development."
2024-06-18,Human Resource,Performance Management,A performance feedback survey was conducted on June 18th to gather feedback from employees on the effectiveness and fairness of performance management processes. The survey results informed future improvements and initiatives.
2024-06-19,Human Resource,Performance Management,June 19th saw the introduction of a performance recognition wall where employees' achievements and contributions were publicly acknowledged and celebrated. The recognition wall promoted a culture of appreciation and recognition.
2024-06-20,Human Resource,Performance Management,An employee performance coaching session was conducted on June 20th to provide employees with personalized feedback and guidance on improving performance and achieving their goals. The coaching session aimed to support employee development and growth.
2024-06-21,Human Resource,Performance Management,"The HR department introduced a performance feedback platform on June 21st, allowing managers and employees to provide and receive real-time feedback on performance and development goals. The platform facilitated continuous communication and improvement."
2024-06-22,Human Resource,Performance Management,June 22nd marked the start of a performance recognition program where employees were nominated and recognized for demonstrating the company's core values and behaviors. The program celebrated achievements and promoted a values-driven culture.
2024-06-23,Human Resource,Performance Management,"An employee performance review workshop was conducted on June 23rd to train managers on conducting fair, objective, and constructive performance evaluations. The workshop provided managers with tools and resources for conducting effective reviews."
2024-06-24,Human Resource,Performance Management,A performance feedback session was held on June 24th to provide employees with feedback on their performance and progress towards their goals. The session encouraged open dialogue and alignment on expectations.
2024-06-25,Human Resource,Performance Management,"The HR department introduced a performance recognition ceremony on June 25th, where top performers were publicly acknowledged and rewarded for their contributions. The ceremony celebrated achievements and motivated employees."
2024-06-26,Human Resource,Performance Management,"June 26th saw the launch of a performance improvement initiative aimed at identifying and addressing performance gaps through targeted training, coaching, and support. The initiative aimed to enhance individual and team performance."
2024-06-27,Human Resource,Performance Management,A performance review calibration session was held on June 27th to ensure consistency and fairness in performance evaluations across departments and teams. The session involved reviewing and aligning performance ratings.
2024-06-28,Human Resource,Performance Management,An employee performance feedback forum was conducted on June 28th to gather feedback from employees on the effectiveness and fairness of performance management processes. The feedback informed continuous improvement efforts.
2024-06-29,Human Resource,Performance Management,June 29th marked the start of a performance planning cycle for the upcoming evaluation period. Managers and employees collaborated to set performance goals and expectations aligned with organizational objectives.
2024-06-30,Human Resource,Performance Management,A performance review software was implemented on June 30th to streamline the performance evaluation process and provide managers and employees with easy access to performance data and feedback.
